03:04:07.457419 IP localhost.5755 > localhost.domain: 55969+ A? www.youtube.com. (33)
03:04:07.457462 IP localhost.12598 > localhost.domain: 53952+ HTTPS? www.youtube.com. (33)
03:04:07.457483 IP localhost.domain > localhost.5755: 55969 Refused 0/0/0 (33)
03:04:07.457497 IP localhost.domain > localhost.12598: 53952 Refused 0/0/0 (33)
03:04:07.457537 IP localhost.27702 > localhost.domain: 31486+ A? www.youtube.com. (33)
03:04:07.457550 IP localhost.domain > localhost.27702: 31486 Refused 0/0/0 (33)
03:04:07.457563 IP localhost.19840 > localhost.domain: 61170+ HTTPS? www.youtube.com. (33)
03:04:07.457574 IP localhost.domain > localhost.19840: 61170 Refused 0/0/0 (33)
03:04:07.457949 IP localhost.59605 > localhost.domain: 60598+ A? www.youtube.com. (33)
03:04:07.457990 IP localhost.domain > localhost.59605: 60598 Refused 0/0/0 (33)
03:04:07.458029 IP localhost.51973 > localhost.domain: 60598+ A? www.youtube.com. (33)
03:04:07.458065 IP localhost.domain > localhost.51973: 60598 Refused 0/0/0 (33)
03:04:07.458335 IP localhost.32338 > localhost.domain: 19651+ A? www.youtube.com. (33)
03:04:07.458366 IP localhost.38081 > localhost.domain: 15840+ HTTPS? www.youtube.com. (33)
03:04:07.458377 IP localhost.domain > localhost.32338: 19651 Refused 0/0/0 (33)
03:04:07.458392 IP localhost.domain > localhost.38081: 15840 Refused 0/0/0 (33)
03:04:07.458773 IP localhost.4747 > localhost.domain: 14876+ A? www.youtube.com. (33)
03:04:07.458808 IP localhost.domain > localhost.4747: 14876 Refused 0/0/0 (33)
03:04:07.458809 IP localhost.38922 > localhost.domain: 7969+ HTTPS? www.youtube.com. (33)
03:04:07.458819 IP localhost.domain > localhost.38922: 7969 Refused 0/0/0 (33)
03:04:07.459046 IP localhost.53581 > localhost.domain: 54983+ A? www.youtube.com. (33)
03:04:07.459080 IP localhost.domain > localhost.53581: 54983 Refused 0/0/0 (33)
03:04:07.459108 IP localhost.33916 > localhost.domain: 54983+ A? www.youtube.com. (33)
03:04:07.459118 IP localhost.domain > localhost.33916: 54983 Refused 0/0/0 (33)
03:04:28.536949 IP localhost.38873 > localhost.domain: 21894+ A? ntp.ubuntu.com. (32)
03:04:28.536961 IP localhost.38873 > localhost.domain: 24704+ AAAA? ntp.ubuntu.com. (32)
03:04:28.537000 IP localhost.domain > localhost.38873: 21894 Refused 0/0/0 (32)
03:04:28.537012 IP localhost.domain > localhost.38873: 24704 Refused 0/0/0 (32)
03:04:28.537026 IP localhost.38873 > localhost.domain: 21894+ A? ntp.ubuntu.com. (32)
03:04:28.537030 IP localhost.38873 > localhost.domain: 24704+ AAAA? ntp.ubuntu.com. (32)
03:04:28.537039 IP localhost.domain > localhost.38873: 21894 Refused 0/0/0 (32)
03:04:28.537046 IP localhost.domain > localhost.38873: 24704 Refused 0/0/0 (32)
03:04:28.537177 IP localhost.37007 > localhost.domain: 10642+ A? ntp.ubuntu.com. (32)
03:04:28.537183 IP localhost.37007 > localhost.domain: 62100+ AAAA? ntp.ubuntu.com. (32)
03:04:28.537202 IP localhost.domain > localhost.37007: 10642 Refused 0/0/0 (32)
03:04:28.537210 IP localhost.domain > localhost.37007: 62100 Refused 0/0/0 (32)
03:04:28.537222 IP localhost.37007 > localhost.domain: 10642+ A? ntp.ubuntu.com. (32)
03:04:28.537225 IP localhost.37007 > localhost.domain: 62100+ AAAA? ntp.ubuntu.com. (32)
03:04:28.537233 IP localhost.domain > localhost.37007: 10642 Refused 0/0/0 (32)
03:04:28.537240 IP localhost.domain > localhost.37007: 62100 Refused 0/0/0 (32)
03:04:28.537340 IP localhost.42311 > localhost.domain: 8223+ A? ntp.ubuntu.com. (32)
03:04:28.537345 IP localhost.42311 > localhost.domain: 284+ AAAA? ntp.ubuntu.com. (32)
03:04:28.537361 IP localhost.domain > localhost.42311: 8223 Refused 0/0/0 (32)
03:04:28.537371 IP localhost.domain > localhost.42311: 284 Refused 0/0/0 (32)
03:04:28.537383 IP localhost.42311 > localhost.domain: 8223+ A? ntp.ubuntu.com. (32)
03:04:28.537386 IP localhost.42311 > localhost.domain: 284+ AAAA? ntp.ubuntu.com. (32)
03:04:28.537395 IP localhost.domain > localhost.42311: 8223 Refused 0/0/0 (32)
03:04:28.537402 IP localhost.domain > localhost.42311: 284 Refused 0/0/0 (32)
03:04:28.537491 IP localhost.43670 > localhost.domain: 49231+ A? ntp.ubuntu.com. (32)
03:04:28.537496 IP localhost.43670 > localhost.domain: 39240+ AAAA? ntp.ubuntu.com. (32)
03:04:28.537511 IP localhost.domain > localhost.43670: 49231 Refused 0/0/0 (32)
03:04:28.537519 IP localhost.domain > localhost.43670: 39240 Refused 0/0/0 (32)
03:04:28.537530 IP localhost.43670 > localhost.domain: 49231+ A? ntp.ubuntu.com. (32)
03:04:28.537534 IP localhost.43670 > localhost.domain: 39240+ AAAA? ntp.ubuntu.com. (32)
03:04:28.537542 IP localhost.domain > localhost.43670: 49231 Refused 0/0/0 (32)
03:04:28.537549 IP localhost.domain > localhost.43670: 39240 Refused 0/0/0 (32)
03:04:28.537631 IP localhost.53857 > localhost.domain: 56732+ A? ntp.ubuntu.com. (32)
03:04:28.537636 IP localhost.53857 > localhost.domain: 7836+ AAAA? ntp.ubuntu.com. (32)
03:04:28.537651 IP localhost.domain > localhost.53857: 56732 Refused 0/0/0 (32)
03:04:28.537659 IP localhost.domain > localhost.53857: 7836 Refused 0/0/0 (32)
03:04:28.537670 IP localhost.53857 > localhost.domain: 56732+ A? ntp.ubuntu.com. (32)
03:04:28.537673 IP localhost.53857 > localhost.domain: 7836+ AAAA? ntp.ubuntu.com. (32)
03:04:28.537682 IP localhost.domain > localhost.53857: 56732 Refused 0/0/0 (32)
03:04:28.537688 IP localhost.domain > localhost.53857: 7836 Refused 0/0/0 (32)
03:04:28.537778 IP localhost.57059 > localhost.domain: 32741+ A? ntp.ubuntu.com. (32)
03:04:28.537784 IP localhost.57059 > localhost.domain: 13286+ AAAA? ntp.ubuntu.com. (32)
03:04:28.537799 IP localhost.domain > localhost.57059: 32741 Refused 0/0/0 (32)
03:04:28.537807 IP localhost.domain > localhost.57059: 13286 Refused 0/0/0 (32)
03:04:28.537817 IP localhost.57059 > localhost.domain: 32741+ A? ntp.ubuntu.com. (32)
03:04:28.537821 IP localhost.57059 > localhost.domain: 13286+ AAAA? ntp.ubuntu.com. (32)
03:04:28.537829 IP localhost.domain > localhost.57059: 32741 Refused 0/0/0 (32)
03:04:28.537836 IP localhost.domain > localhost.57059: 13286 Refused 0/0/0 (32)
03:04:28.537922 IP localhost.43212 > localhost.domain: 16421+ A? ntp.ubuntu.com. (32)
03:04:28.537928 IP localhost.43212 > localhost.domain: 33061+ AAAA? ntp.ubuntu.com. (32)
03:04:28.537943 IP localhost.domain > localhost.43212: 16421 Refused 0/0/0 (32)
03:04:28.537951 IP localhost.domain > localhost.43212: 33061 Refused 0/0/0 (32)
03:04:28.537963 IP localhost.43212 > localhost.domain: 16421+ A? ntp.ubuntu.com. (32)
03:04:28.537966 IP localhost.43212 > localhost.domain: 33061+ AAAA? ntp.ubuntu.com. (32)
03:04:28.537974 IP localhost.domain > localhost.43212: 16421 Refused 0/0/0 (32)
03:04:28.537981 IP localhost.domain > localhost.43212: 33061 Refused 0/0/0 (32)
03:04:28.538097 IP localhost.47119 > localhost.domain: 17813+ A? ntp.ubuntu.com. (32)
03:04:28.538103 IP localhost.47119 > localhost.domain: 15252+ AAAA? ntp.ubuntu.com. (32)
03:04:28.538122 IP localhost.domain > localhost.47119: 17813 Refused 0/0/0 (32)
03:04:28.538131 IP localhost.domain > localhost.47119: 15252 Refused 0/0/0 (32)
03:04:28.538143 IP localhost.47119 > localhost.domain: 17813+ A? ntp.ubuntu.com. (32)
03:04:28.538146 IP localhost.47119 > localhost.domain: 15252+ AAAA? ntp.ubuntu.com. (32)
03:04:28.538155 IP localhost.domain > localhost.47119: 17813 Refused 0/0/0 (32)
03:04:28.538161 IP localhost.domain > localhost.47119: 15252 Refused 0/0/0 (32)
03:04:28.538253 IP localhost.41073 > localhost.domain: 62684+ A? ntp.ubuntu.com. (32)
03:04:28.538258 IP localhost.41073 > localhost.domain: 43229+ AAAA? ntp.ubuntu.com. (32)
03:04:28.538274 IP localhost.domain > localhost.41073: 62684 Refused 0/0/0 (32)
03:04:28.538282 IP localhost.domain > localhost.41073: 43229 Refused 0/0/0 (32)
03:04:28.538294 IP localhost.41073 > localhost.domain: 62684+ A? ntp.ubuntu.com. (32)
03:04:28.538297 IP localhost.41073 > localhost.domain: 43229+ AAAA? ntp.ubuntu.com. (32)
03:04:28.538305 IP localhost.domain > localhost.41073: 62684 Refused 0/0/0 (32)
03:04:28.538312 IP localhost.domain > localhost.41073: 43229 Refused 0/0/0 (32)
03:04:28.538394 IP localhost.46905 > localhost.domain: 21641+ A? ntp.ubuntu.com. (32)
03:04:28.538399 IP localhost.46905 > localhost.domain: 11150+ AAAA? ntp.ubuntu.com. (32)
03:04:28.538414 IP localhost.domain > localhost.46905: 21641 Refused 0/0/0 (32)
03:04:28.538422 IP localhost.domain > localhost.46905: 11150 Refused 0/0/0 (32)
03:04:28.538433 IP localhost.46905 > localhost.domain: 21641+ A? ntp.ubuntu.com. (32)
03:04:28.538436 IP localhost.46905 > localhost.domain: 11150+ AAAA? ntp.ubuntu.com. (32)
03:04:28.538445 IP localhost.domain > localhost.46905: 21641 Refused 0/0/0 (32)
03:04:28.538451 IP localhost.domain > localhost.46905: 11150 Refused 0/0/0 (32)
03:04:37.483789 IP localhost.29862 > localhost.domain: 36232+ A? www.youtube.com. (33)
03:04:37.483855 IP localhost.domain > localhost.29862: 36232 Refused 0/0/0 (33)
03:04:37.484065 IP localhost.33309 > localhost.domain: 49253+ A? www.youtube.com. (33)
03:04:37.484082 IP localhost.domain > localhost.33309: 49253 Refused 0/0/0 (33)
03:04:37.484122 IP localhost.63779 > localhost.domain: 39873+ HTTPS? www.youtube.com. (33)
03:04:37.484132 IP localhost.domain > localhost.63779: 39873 Refused 0/0/0 (33)
03:04:37.484154 IP localhost.64467 > localhost.domain: 30759+ HTTPS? www.youtube.com. (33)
03:04:37.484163 IP localhost.domain > localhost.64467: 30759 Refused 0/0/0 (33)
03:04:37.484620 IP localhost.51453 > localhost.domain: 64039+ A? www.youtube.com. (33)
03:04:37.484665 IP localhost.domain > localhost.51453: 64039 Refused 0/0/0 (33)
03:04:37.484798 IP localhost.56442 > localhost.domain: 64039+ A? www.youtube.com. (33)
03:04:37.484814 IP localhost.domain > localhost.56442: 64039 Refused 0/0/0 (33)
03:04:37.485329 IP localhost.54912 > localhost.domain: 12564+ A? www.youtube.com. (33)
03:04:37.485378 IP localhost.domain > localhost.54912: 12564 Refused 0/0/0 (33)
03:04:37.485418 IP localhost.58032 > localhost.domain: 17094+ A? www.youtube.com. (33)
03:04:37.485429 IP localhost.domain > localhost.58032: 17094 Refused 0/0/0 (33)
03:04:37.485460 IP localhost.18507 > localhost.domain: 61445+ HTTPS? www.youtube.com. (33)
03:04:37.485471 IP localhost.domain > localhost.18507: 61445 Refused 0/0/0 (33)
03:04:37.485493 IP localhost.11639 > localhost.domain: 12604+ HTTPS? www.youtube.com. (33)
03:04:37.485503 IP localhost.domain > localhost.11639: 12604 Refused 0/0/0 (33)
03:04:37.486112 IP localhost.37791 > localhost.domain: 55087+ A? www.youtube.com. (33)
03:04:37.486155 IP localhost.domain > localhost.37791: 55087 Refused 0/0/0 (33)
03:04:37.486220 IP localhost.47999 > localhost.domain: 55087+ A? www.youtube.com. (33)
03:04:37.486231 IP localhost.domain > localhost.47999: 55087 Refused 0/0/0 (33)
03:04:42.659883 IP localhost.32886 > localhost.domain: 13749+ A? ssl.gstatic.com. (33)
03:04:42.659939 IP localhost.domain > localhost.32886: 13749 Refused 0/0/0 (33)
03:04:42.660126 IP localhost.21343 > localhost.domain: 53150+ A? ssl.gstatic.com. (33)
03:04:42.660143 IP localhost.domain > localhost.21343: 53150 Refused 0/0/0 (33)
03:04:42.660176 IP localhost.30687 > localhost.domain: 48677+ HTTPS? ssl.gstatic.com. (33)
03:04:42.660186 IP localhost.domain > localhost.30687: 48677 Refused 0/0/0 (33)
03:04:42.660207 IP localhost.59387 > localhost.domain: 47478+ HTTPS? ssl.gstatic.com. (33)
03:04:42.660217 IP localhost.domain > localhost.59387: 47478 Refused 0/0/0 (33)
03:04:42.660542 IP localhost.33006 > localhost.domain: 9288+ A? ssl.gstatic.com. (33)
03:04:42.660579 IP localhost.domain > localhost.33006: 9288 Refused 0/0/0 (33)
03:04:42.660667 IP localhost.33684 > localhost.domain: 9288+ A? ssl.gstatic.com. (33)
03:04:42.660681 IP localhost.domain > localhost.33684: 9288 Refused 0/0/0 (33)
03:04:42.660941 IP localhost.23717 > localhost.domain: 61454+ A? ssl.gstatic.com. (33)
03:04:42.660984 IP localhost.domain > localhost.23717: 61454 Refused 0/0/0 (33)
03:04:42.661378 IP localhost.4299 > localhost.domain: 11253+ A? ssl.gstatic.com. (33)
03:04:42.661423 IP localhost.domain > localhost.4299: 11253 Refused 0/0/0 (33)
03:04:42.661467 IP localhost.24673 > localhost.domain: 33811+ HTTPS? ssl.gstatic.com. (33)
03:04:42.661477 IP localhost.domain > localhost.24673: 33811 Refused 0/0/0 (33)
03:04:42.661499 IP localhost.22957 > localhost.domain: 56099+ HTTPS? ssl.gstatic.com. (33)
03:04:42.661508 IP localhost.domain > localhost.22957: 56099 Refused 0/0/0 (33)
03:04:42.661776 IP localhost.39045 > localhost.domain: 40028+ A? ssl.gstatic.com. (33)
03:04:42.661802 IP localhost.domain > localhost.39045: 40028 Refused 0/0/0 (33)
03:04:42.661826 IP localhost.52781 > localhost.domain: 40028+ A? ssl.gstatic.com. (33)
03:04:42.661835 IP localhost.domain > localhost.52781: 40028 Refused 0/0/0 (33)
03:04:45.667125 IP localhost.12165 > localhost.domain: 29900+ A? docs.google.com. (33)
03:04:45.667185 IP localhost.domain > localhost.12165: 29900 Refused 0/0/0 (33)
03:04:45.667225 IP localhost.36378 > localhost.domain: 16107+ A? docs.google.com. (33)
03:04:45.667236 IP localhost.domain > localhost.36378: 16107 Refused 0/0/0 (33)
03:04:45.667267 IP localhost.61972 > localhost.domain: 56505+ HTTPS? docs.google.com. (33)
03:04:45.667277 IP localhost.domain > localhost.61972: 56505 Refused 0/0/0 (33)
03:04:45.667376 IP localhost.62849 > localhost.domain: 22332+ HTTPS? docs.google.com. (33)
03:04:45.667394 IP localhost.domain > localhost.62849: 22332 Refused 0/0/0 (33)
03:04:45.667712 IP localhost.54227 > localhost.domain: 42572+ A? docs.google.com. (33)
03:04:45.667759 IP localhost.domain > localhost.54227: 42572 Refused 0/0/0 (33)
03:04:45.667783 IP localhost.59466 > localhost.domain: 42572+ A? docs.google.com. (33)
03:04:45.667793 IP localhost.domain > localhost.59466: 42572 Refused 0/0/0 (33)
03:04:45.668013 IP localhost.57126 > localhost.domain: 9606+ A? docs.google.com. (33)
03:04:45.668043 IP localhost.domain > localhost.57126: 9606 Refused 0/0/0 (33)
03:04:45.668074 IP localhost.15475 > localhost.domain: 4965+ A? docs.google.com. (33)
03:04:45.668101 IP localhost.domain > localhost.15475: 4965 Refused 0/0/0 (33)
03:04:45.668107 IP localhost.32183 > localhost.domain: 13858+ HTTPS? docs.google.com. (33)
03:04:45.668137 IP localhost.domain > localhost.32183: 13858 Refused 0/0/0 (33)
03:04:45.668379 IP localhost.57998 > localhost.domain: 9868+ A? docs.google.com. (33)
03:04:45.668413 IP localhost.domain > localhost.57998: 9868 Refused 0/0/0 (33)
03:04:45.668433 IP localhost.34785 > localhost.domain: 9868+ A? docs.google.com. (33)
03:04:45.668442 IP localhost.domain > localhost.34785: 9868 Refused 0/0/0 (33)
03:04:52.671178 IP localhost.19524 > localhost.domain: 33806+ A? ssl.gstatic.com. (33)
03:04:52.671222 IP localhost.6197 > localhost.domain: 39756+ HTTPS? ssl.gstatic.com. (33)
03:04:52.671241 IP localhost.domain > localhost.19524: 33806 Refused 0/0/0 (33)
03:04:52.671255 IP localhost.domain > localhost.6197: 39756 Refused 0/0/0 (33)
03:04:52.671300 IP localhost.28574 > localhost.domain: 2416+ A? ssl.gstatic.com. (33)
03:04:52.671311 IP localhost.domain > localhost.28574: 2416 Refused 0/0/0 (33)
03:04:52.671323 IP localhost.64347 > localhost.domain: 65436+ HTTPS? ssl.gstatic.com. (33)
03:04:52.671332 IP localhost.domain > localhost.64347: 65436 Refused 0/0/0 (33)
03:04:52.671865 IP localhost.56554 > localhost.domain: 17332+ A? ssl.gstatic.com. (33)
03:04:52.671900 IP localhost.domain > localhost.56554: 17332 Refused 0/0/0 (33)
03:04:52.671927 IP localhost.34662 > localhost.domain: 17332+ A? ssl.gstatic.com. (33)
03:04:52.671938 IP localhost.domain > localhost.34662: 17332 Refused 0/0/0 (33)
03:04:52.672464 IP localhost.2791 > localhost.domain: 29745+ A? ssl.gstatic.com. (33)
03:04:52.672504 IP localhost.20211 > localhost.domain: 53200+ HTTPS? ssl.gstatic.com. (33)
03:04:52.672523 IP localhost.domain > localhost.2791: 29745 Refused 0/0/0 (33)
03:04:52.672540 IP localhost.domain > localhost.20211: 53200 Refused 0/0/0 (33)
03:04:52.672670 IP localhost.57533 > localhost.domain: 41532+ A? ssl.gstatic.com. (33)
03:04:52.672687 IP localhost.domain > localhost.57533: 41532 Refused 0/0/0 (33)
03:04:52.672749 IP localhost.65302 > localhost.domain: 44197+ HTTPS? ssl.gstatic.com. (33)
03:04:52.672763 IP localhost.domain > localhost.65302: 44197 Refused 0/0/0 (33)
03:04:52.673009 IP localhost.45244 > localhost.domain: 214+ A? ssl.gstatic.com. (33)
03:04:52.673035 IP localhost.domain > localhost.45244: 214 Refused 0/0/0 (33)
03:04:52.673061 IP localhost.35564 > localhost.domain: 214+ A? ssl.gstatic.com. (33)
03:04:52.673070 IP localhost.domain > localhost.35564: 214 Refused 0/0/0 (33)
03:04:58.786951 IP localhost.53619 > localhost.domain: 20078+ A? ntp.ubuntu.com. (32)
03:04:58.786961 IP localhost.53619 > localhost.domain: 44896+ AAAA? ntp.ubuntu.com. (32)
03:04:58.787005 IP localhost.domain > localhost.53619: 20078 Refused 0/0/0 (32)
03:04:58.787020 IP localhost.domain > localhost.53619: 44896 Refused 0/0/0 (32)
03:04:58.787030 IP localhost.53619 > localhost.domain: 20078+ A? ntp.ubuntu.com. (32)
03:04:58.787034 IP localhost.53619 > localhost.domain: 44896+ AAAA? ntp.ubuntu.com. (32)
03:04:58.787042 IP localhost.domain > localhost.53619: 20078 Refused 0/0/0 (32)
03:04:58.787049 IP localhost.domain > localhost.53619: 44896 Refused 0/0/0 (32)
03:04:58.787171 IP localhost.49057 > localhost.domain: 60541+ A? ntp.ubuntu.com. (32)
03:04:58.787176 IP localhost.49057 > localhost.domain: 33148+ AAAA? ntp.ubuntu.com. (32)
03:04:58.787201 IP localhost.domain > localhost.49057: 60541 Refused 0/0/0 (32)
03:04:58.787213 IP localhost.domain > localhost.49057: 33148 Refused 0/0/0 (32)
03:04:58.787222 IP localhost.49057 > localhost.domain: 60541+ A? ntp.ubuntu.com. (32)
03:04:58.787225 IP localhost.49057 > localhost.domain: 33148+ AAAA? ntp.ubuntu.com. (32)
03:04:58.787236 IP localhost.domain > localhost.49057: 60541 Refused 0/0/0 (32)
03:04:58.787243 IP localhost.domain > localhost.49057: 33148 Refused 0/0/0 (32)
03:04:58.787334 IP localhost.36808 > localhost.domain: 25074+ A? ntp.ubuntu.com. (32)
03:04:58.787338 IP localhost.36808 > localhost.domain: 45555+ AAAA? ntp.ubuntu.com. (32)
03:04:58.787351 IP localhost.domain > localhost.36808: 25074 Refused 0/0/0 (32)
03:04:58.787361 IP localhost.domain > localhost.36808: 45555 Refused 0/0/0 (32)
03:04:58.787369 IP localhost.36808 > localhost.domain: 25074+ A? ntp.ubuntu.com. (32)
03:04:58.787373 IP localhost.36808 > localhost.domain: 45555+ AAAA? ntp.ubuntu.com. (32)
03:04:58.787377 IP localhost.domain > localhost.36808: 25074 Refused 0/0/0 (32)
03:04:58.787384 IP localhost.domain > localhost.36808: 45555 Refused 0/0/0 (32)
03:04:58.787470 IP localhost.58857 > localhost.domain: 58780+ A? ntp.ubuntu.com. (32)
03:04:58.787477 IP localhost.58857 > localhost.domain: 30621+ AAAA? ntp.ubuntu.com. (32)
03:04:58.787499 IP localhost.domain > localhost.58857: 58780 Refused 0/0/0 (32)
03:04:58.787513 IP localhost.domain > localhost.58857: 30621 Refused 0/0/0 (32)
03:04:58.787522 IP localhost.58857 > localhost.domain: 58780+ A? ntp.ubuntu.com. (32)
03:04:58.787526 IP localhost.58857 > localhost.domain: 30621+ AAAA? ntp.ubuntu.com. (32)
03:04:58.787542 IP localhost.domain > localhost.58857: 58780 Refused 0/0/0 (32)
03:04:58.787554 IP localhost.domain > localhost.58857: 30621 Refused 0/0/0 (32)
03:04:58.787715 IP localhost.50181 > localhost.domain: 56381+ A? ntp.ubuntu.com. (32)
03:04:58.787722 IP localhost.50181 > localhost.domain: 30527+ AAAA? ntp.ubuntu.com. (32)
03:04:58.787748 IP localhost.domain > localhost.50181: 56381 Refused 0/0/0 (32)
03:04:58.787760 IP localhost.domain > localhost.50181: 30527 Refused 0/0/0 (32)
03:04:58.787767 IP localhost.50181 > localhost.domain: 56381+ A? ntp.ubuntu.com. (32)
03:04:58.787771 IP localhost.50181 > localhost.domain: 30527+ AAAA? ntp.ubuntu.com. (32)
03:04:58.787787 IP localhost.domain > localhost.50181: 56381 Refused 0/0/0 (32)
03:04:58.787796 IP localhost.domain > localhost.50181: 30527 Refused 0/0/0 (32)
03:04:58.787938 IP localhost.40730 > localhost.domain: 1703+ A? ntp.ubuntu.com. (32)
03:04:58.787944 IP localhost.40730 > localhost.domain: 56742+ AAAA? ntp.ubuntu.com. (32)
03:04:58.787968 IP localhost.domain > localhost.40730: 1703 Refused 0/0/0 (32)
03:04:58.787980 IP localhost.domain > localhost.40730: 56742 Refused 0/0/0 (32)
03:04:58.787987 IP localhost.40730 > localhost.domain: 1703+ A? ntp.ubuntu.com. (32)
03:04:58.787991 IP localhost.40730 > localhost.domain: 56742+ AAAA? ntp.ubuntu.com. (32)
03:04:58.788007 IP localhost.domain > localhost.40730: 1703 Refused 0/0/0 (32)
03:04:58.788016 IP localhost.domain > localhost.40730: 56742 Refused 0/0/0 (32)
03:04:58.788161 IP localhost.55787 > localhost.domain: 44820+ A? ntp.ubuntu.com. (32)
03:04:58.788167 IP localhost.55787 > localhost.domain: 37909+ AAAA? ntp.ubuntu.com. (32)
03:04:58.788191 IP localhost.domain > localhost.55787: 44820 Refused 0/0/0 (32)
03:04:58.788203 IP localhost.domain > localhost.55787: 37909 Refused 0/0/0 (32)
03:04:58.788210 IP localhost.55787 > localhost.domain: 44820+ A? ntp.ubuntu.com. (32)
03:04:58.788214 IP localhost.55787 > localhost.domain: 37909+ AAAA? ntp.ubuntu.com. (32)
03:04:58.788230 IP localhost.domain > localhost.55787: 44820 Refused 0/0/0 (32)
03:04:58.788239 IP localhost.domain > localhost.55787: 37909 Refused 0/0/0 (32)
03:04:58.788373 IP localhost.43748 > localhost.domain: 36178+ A? ntp.ubuntu.com. (32)
03:04:58.788379 IP localhost.43748 > localhost.domain: 55633+ AAAA? ntp.ubuntu.com. (32)
03:04:58.788403 IP localhost.domain > localhost.43748: 36178 Refused 0/0/0 (32)
03:04:58.788415 IP localhost.domain > localhost.43748: 55633 Refused 0/0/0 (32)
03:04:58.788421 IP localhost.43748 > localhost.domain: 36178+ A? ntp.ubuntu.com. (32)
03:04:58.788425 IP localhost.43748 > localhost.domain: 55633+ AAAA? ntp.ubuntu.com. (32)
03:04:58.788441 IP localhost.domain > localhost.43748: 36178 Refused 0/0/0 (32)
03:04:58.788450 IP localhost.domain > localhost.43748: 55633 Refused 0/0/0 (32)
03:04:58.788586 IP localhost.49539 > localhost.domain: 10633+ A? ntp.ubuntu.com. (32)
03:04:58.788591 IP localhost.49539 > localhost.domain: 54664+ AAAA? ntp.ubuntu.com. (32)
03:04:58.788615 IP localhost.domain > localhost.49539: 10633 Refused 0/0/0 (32)
03:04:58.788627 IP localhost.domain > localhost.49539: 54664 Refused 0/0/0 (32)
03:04:58.788634 IP localhost.49539 > localhost.domain: 10633+ A? ntp.ubuntu.com. (32)
03:04:58.788638 IP localhost.49539 > localhost.domain: 54664+ AAAA? ntp.ubuntu.com. (32)
03:04:58.788644 IP localhost.domain > localhost.49539: 10633 Refused 0/0/0 (32)
03:04:58.788650 IP localhost.domain > localhost.49539: 54664 Refused 0/0/0 (32)
03:04:58.788740 IP localhost.42012 > localhost.domain: 6418+ A? ntp.ubuntu.com. (32)
03:04:58.788746 IP localhost.42012 > localhost.domain: 24093+ AAAA? ntp.ubuntu.com. (32)
03:04:58.788764 IP localhost.domain > localhost.42012: 6418 Refused 0/0/0 (32)
03:04:58.788777 IP localhost.domain > localhost.42012: 24093 Refused 0/0/0 (32)
03:04:58.788810 IP localhost.42012 > localhost.domain: 6418+ A? ntp.ubuntu.com. (32)
03:04:58.788815 IP localhost.42012 > localhost.domain: 24093+ AAAA? ntp.ubuntu.com. (32)
03:04:58.788821 IP localhost.domain > localhost.42012: 6418 Refused 0/0/0 (32)
03:04:58.788828 IP localhost.domain > localhost.42012: 24093 Refused 0/0/0 (32)
03:05:02.677233 IP localhost.42331 > localhost.domain: 45701+ A? ssl.gstatic.com. (33)
03:05:02.677289 IP localhost.domain > localhost.42331: 45701 Refused 0/0/0 (33)
03:05:02.677771 IP localhost.38319 > localhost.domain: 59664+ A? ssl.gstatic.com. (33)
03:05:02.677811 IP localhost.domain > localhost.38319: 59664 Refused 0/0/0 (33)
03:05:02.677849 IP localhost.22881 > localhost.domain: 17492+ HTTPS? ssl.gstatic.com. (33)
03:05:02.677868 IP localhost.domain > localhost.22881: 17492 Refused 0/0/0 (33)
03:05:02.680096 IP localhost.24994 > localhost.domain: 727+ HTTPS? ssl.gstatic.com. (33)
03:05:02.680367 IP localhost.domain > localhost.24994: 727 Refused 0/0/0 (33)
03:05:02.681127 IP localhost.36965 > localhost.domain: 18638+ A? ssl.gstatic.com. (33)
03:05:02.681180 IP localhost.domain > localhost.36965: 18638 Refused 0/0/0 (33)
03:05:02.681219 IP localhost.51703 > localhost.domain: 18638+ A? ssl.gstatic.com. (33)
03:05:02.681231 IP localhost.domain > localhost.51703: 18638 Refused 0/0/0 (33)
03:05:02.681495 IP localhost.59682 > localhost.domain: 17223+ A? ssl.gstatic.com. (33)
03:05:02.681531 IP localhost.domain > localhost.59682: 17223 Refused 0/0/0 (33)
03:05:02.681702 IP localhost.29524 > localhost.domain: 39643+ A? ssl.gstatic.com. (33)
03:05:02.681740 IP localhost.domain > localhost.29524: 39643 Refused 0/0/0 (33)
03:05:02.681745 IP localhost.65092 > localhost.domain: 7905+ HTTPS? ssl.gstatic.com. (33)
03:05:02.681752 IP localhost.domain > localhost.65092: 7905 Refused 0/0/0 (33)
03:05:02.681994 IP localhost.33455 > localhost.domain: 58677+ A? ssl.gstatic.com. (33)
03:05:02.682041 IP localhost.domain > localhost.33455: 58677 Refused 0/0/0 (33)
03:05:02.682069 IP localhost.54932 > localhost.domain: 58677+ A? ssl.gstatic.com. (33)
03:05:02.682091 IP localhost.domain > localhost.54932: 58677 Refused 0/0/0 (33)
03:05:07.510738 IP localhost.61148 > localhost.domain: 38443+ A? www.youtube.com. (33)
03:05:07.510783 IP localhost.18993 > localhost.domain: 53454+ HTTPS? www.youtube.com. (33)
03:05:07.510802 IP localhost.domain > localhost.61148: 38443 Refused 0/0/0 (33)
03:05:07.510816 IP localhost.domain > localhost.18993: 53454 Refused 0/0/0 (33)
03:05:07.510852 IP localhost.20633 > localhost.domain: 59694+ A? www.youtube.com. (33)
03:05:07.510877 IP localhost.domain > localhost.20633: 59694 Refused 0/0/0 (33)
03:05:07.511173 IP localhost.37727 > localhost.domain: 3123+ A? www.youtube.com. (33)
03:05:07.511224 IP localhost.domain > localhost.37727: 3123 Refused 0/0/0 (33)
03:05:07.511255 IP localhost.60155 > localhost.domain: 3123+ A? www.youtube.com. (33)
03:05:07.511276 IP localhost.domain > localhost.60155: 3123 Refused 0/0/0 (33)
03:05:07.511515 IP localhost.62444 > localhost.domain: 15648+ A? www.youtube.com. (33)
03:05:07.511547 IP localhost.domain > localhost.62444: 15648 Refused 0/0/0 (33)
03:05:07.511547 IP localhost.16553 > localhost.domain: 10314+ HTTPS? www.youtube.com. (33)
03:05:07.511557 IP localhost.domain > localhost.16553: 10314 Refused 0/0/0 (33)
03:05:07.511585 IP localhost.55960 > localhost.domain: 50311+ A? www.youtube.com. (33)
03:05:07.511594 IP localhost.domain > localhost.55960: 50311 Refused 0/0/0 (33)
03:05:07.511607 IP localhost.56287 > localhost.domain: 37906+ HTTPS? www.youtube.com. (33)
03:05:07.511615 IP localhost.domain > localhost.56287: 37906 Refused 0/0/0 (33)
03:05:07.511791 IP localhost.37575 > localhost.domain: 61923+ A? www.youtube.com. (33)
03:05:07.511826 IP localhost.domain > localhost.37575: 61923 Refused 0/0/0 (33)
03:05:07.511855 IP localhost.34835 > localhost.domain: 61923+ A? www.youtube.com. (33)
03:05:07.511867 IP localhost.domain > localhost.34835: 61923 Refused 0/0/0 (33)
03:05:12.685739 IP localhost.51498 > localhost.domain: 40841+ A? ssl.gstatic.com. (33)
03:05:12.685795 IP localhost.domain > localhost.51498: 40841 Refused 0/0/0 (33)
03:05:12.685832 IP localhost.15614 > localhost.domain: 35718+ A? ssl.gstatic.com. (33)
03:05:12.685843 IP localhost.domain > localhost.15614: 35718 Refused 0/0/0 (33)
03:05:12.685871 IP localhost.55764 > localhost.domain: 4714+ HTTPS? ssl.gstatic.com. (33)
03:05:12.685881 IP localhost.domain > localhost.55764: 4714 Refused 0/0/0 (33)
03:05:12.685904 IP localhost.1932 > localhost.domain: 16837+ HTTPS? ssl.gstatic.com. (33)
03:05:12.685913 IP localhost.domain > localhost.1932: 16837 Refused 0/0/0 (33)
03:05:12.686252 IP localhost.43654 > localhost.domain: 1528+ A? ssl.gstatic.com. (33)
03:05:12.686292 IP localhost.domain > localhost.43654: 1528 Refused 0/0/0 (33)
03:05:12.686368 IP localhost.37187 > localhost.domain: 1528+ A? ssl.gstatic.com. (33)
03:05:12.686386 IP localhost.domain > localhost.37187: 1528 Refused 0/0/0 (33)
03:05:12.686711 IP localhost.36367 > localhost.domain: 56918+ A? ssl.gstatic.com. (33)
03:05:12.686746 IP localhost.53364 > localhost.domain: 45665+ HTTPS? ssl.gstatic.com. (33)
03:05:12.686766 IP localhost.domain > localhost.36367: 56918 Refused 0/0/0 (33)
03:05:12.686782 IP localhost.domain > localhost.53364: 45665 Refused 0/0/0 (33)
03:05:12.686830 IP localhost.42345 > localhost.domain: 27199+ A? ssl.gstatic.com. (33)
03:05:12.686844 IP localhost.domain > localhost.42345: 27199 Refused 0/0/0 (33)
03:05:12.686854 IP localhost.37910 > localhost.domain: 37518+ HTTPS? ssl.gstatic.com. (33)
03:05:12.686863 IP localhost.domain > localhost.37910: 37518 Refused 0/0/0 (33)
03:05:12.687060 IP localhost.49262 > localhost.domain: 26496+ A? ssl.gstatic.com. (33)
03:05:12.687094 IP localhost.domain > localhost.49262: 26496 Refused 0/0/0 (33)
03:05:12.687124 IP localhost.44742 > localhost.domain: 26496+ A? ssl.gstatic.com. (33)
03:05:12.687146 IP localhost.domain > localhost.44742: 26496 Refused 0/0/0 (33)
03:05:13.914515 IP localhost.57796 > localhost.domain: 45844+ A? WORKGROUP. (27)
03:05:13.914536 IP localhost.57796 > localhost.domain: 48666+ AAAA? WORKGROUP. (27)
03:05:13.914587 IP localhost.domain > localhost.57796: 45844 Refused 0/0/0 (27)
03:05:13.914605 IP localhost.domain > localhost.57796: 48666 Refused 0/0/0 (27)
03:05:13.914695 IP localhost.57796 > localhost.domain: 45844+ A? WORKGROUP. (27)
03:05:13.914700 IP localhost.57796 > localhost.domain: 48666+ AAAA? WORKGROUP. (27)
03:05:13.914753 IP localhost.domain > localhost.57796: 45844 Refused 0/0/0 (27)
03:05:13.914766 IP localhost.domain > localhost.57796: 48666 Refused 0/0/0 (27)
03:05:13.915233 IP localhost.47841 > localhost.domain: 54065+ A? WORKGROUP. (27)
03:05:13.915251 IP localhost.47841 > localhost.domain: 9007+ AAAA? WORKGROUP. (27)
03:05:13.915298 IP localhost.domain > localhost.47841: 54065 Refused 0/0/0 (27)
03:05:13.915315 IP localhost.domain > localhost.47841: 9007 Refused 0/0/0 (27)
03:05:13.915621 IP localhost.47841 > localhost.domain: 54065+ A? WORKGROUP. (27)
03:05:13.915635 IP localhost.47841 > localhost.domain: 9007+ AAAA? WORKGROUP. (27)
03:05:13.915673 IP localhost.domain > localhost.47841: 54065 Refused 0/0/0 (27)
03:05:13.915687 IP localhost.domain > localhost.47841: 9007 Refused 0/0/0 (27)
03:05:22.691777 IP localhost.16125 > localhost.domain: 1505+ A? ssl.gstatic.com. (33)
03:05:22.691820 IP localhost.15306 > localhost.domain: 23277+ HTTPS? ssl.gstatic.com. (33)
03:05:22.691845 IP localhost.domain > localhost.16125: 1505 Refused 0/0/0 (33)
03:05:22.691858 IP localhost.domain > localhost.15306: 23277 Refused 0/0/0 (33)
03:05:22.691898 IP localhost.34115 > localhost.domain: 60246+ A? ssl.gstatic.com. (33)
03:05:22.691919 IP localhost.domain > localhost.34115: 60246 Refused 0/0/0 (33)
03:05:22.692166 IP localhost.46334 > localhost.domain: 49530+ A? ssl.gstatic.com. (33)
03:05:22.692187 IP localhost.domain > localhost.46334: 49530 Refused 0/0/0 (33)
03:05:22.692209 IP localhost.46638 > localhost.domain: 49530+ A? ssl.gstatic.com. (33)
03:05:22.692220 IP localhost.domain > localhost.46638: 49530 Refused 0/0/0 (33)
03:05:22.692470 IP localhost.12771 > localhost.domain: 8043+ A? ssl.gstatic.com. (33)
03:05:22.692504 IP localhost.domain > localhost.12771: 8043 Refused 0/0/0 (33)
03:05:22.692536 IP localhost.28283 > localhost.domain: 13641+ A? ssl.gstatic.com. (33)
03:05:22.692547 IP localhost.domain > localhost.28283: 13641 Refused 0/0/0 (33)
03:05:22.692574 IP localhost.44214 > localhost.domain: 42961+ HTTPS? ssl.gstatic.com. (33)
03:05:22.692607 IP localhost.domain > localhost.44214: 42961 Refused 0/0/0 (33)
03:05:22.692815 IP localhost.40180 > localhost.domain: 40861+ A? ssl.gstatic.com. (33)
03:05:22.692839 IP localhost.domain > localhost.40180: 40861 Refused 0/0/0 (33)
03:05:22.692863 IP localhost.39424 > localhost.domain: 40861+ A? ssl.gstatic.com. (33)
03:05:22.692874 IP localhost.domain > localhost.39424: 40861 Refused 0/0/0 (33)
03:05:29.037028 IP localhost.40227 > localhost.domain: 3239+ A? ntp.ubuntu.com. (32)
03:05:29.037044 IP localhost.40227 > localhost.domain: 46504+ AAAA? ntp.ubuntu.com. (32)
03:05:29.037095 IP localhost.domain > localhost.40227: 3239 Refused 0/0/0 (32)
03:05:29.037113 IP localhost.domain > localhost.40227: 46504 Refused 0/0/0 (32)
03:05:29.037183 IP localhost.40227 > localhost.domain: 3239+ A? ntp.ubuntu.com. (32)
03:05:29.037190 IP localhost.40227 > localhost.domain: 46504+ AAAA? ntp.ubuntu.com. (32)
03:05:29.037194 IP localhost.domain > localhost.40227: 3239 Refused 0/0/0 (32)
03:05:29.037205 IP localhost.domain > localhost.40227: 46504 Refused 0/0/0 (32)
03:05:29.037449 IP localhost.51943 > localhost.domain: 56541+ A? ntp.ubuntu.com. (32)
03:05:29.037458 IP localhost.51943 > localhost.domain: 10715+ AAAA? ntp.ubuntu.com. (32)
03:05:29.037460 IP localhost.domain > localhost.51943: 56541 Refused 0/0/0 (32)
03:05:29.037466 IP localhost.domain > localhost.51943: 10715 Refused 0/0/0 (32)
03:05:29.037476 IP localhost.51943 > localhost.domain: 56541+ A? ntp.ubuntu.com. (32)
03:05:29.037486 IP localhost.51943 > localhost.domain: 10715+ AAAA? ntp.ubuntu.com. (32)
03:05:29.037496 IP localhost.domain > localhost.51943: 56541 Refused 0/0/0 (32)
03:05:29.037504 IP localhost.domain > localhost.51943: 10715 Refused 0/0/0 (32)
03:05:29.037646 IP localhost.50188 > localhost.domain: 38251+ A? ntp.ubuntu.com. (32)
03:05:29.037652 IP localhost.50188 > localhost.domain: 54634+ AAAA? ntp.ubuntu.com. (32)
03:05:29.037669 IP localhost.domain > localhost.50188: 38251 Refused 0/0/0 (32)
03:05:29.037678 IP localhost.domain > localhost.50188: 54634 Refused 0/0/0 (32)
03:05:29.037702 IP localhost.50188 > localhost.domain: 38251+ A? ntp.ubuntu.com. (32)
03:05:29.037707 IP localhost.50188 > localhost.domain: 54634+ AAAA? ntp.ubuntu.com. (32)
03:05:29.037712 IP localhost.domain > localhost.50188: 38251 Refused 0/0/0 (32)
03:05:29.037719 IP localhost.domain > localhost.50188: 54634 Refused 0/0/0 (32)
03:05:29.037797 IP localhost.42538 > localhost.domain: 61240+ A? ntp.ubuntu.com. (32)
03:05:29.037802 IP localhost.42538 > localhost.domain: 21048+ AAAA? ntp.ubuntu.com. (32)
03:05:29.037810 IP localhost.domain > localhost.42538: 61240 Refused 0/0/0 (32)
03:05:29.037819 IP localhost.domain > localhost.42538: 21048 Refused 0/0/0 (32)
03:05:29.037845 IP localhost.42538 > localhost.domain: 61240+ A? ntp.ubuntu.com. (32)
03:05:29.037849 IP localhost.42538 > localhost.domain: 21048+ AAAA? ntp.ubuntu.com. (32)
03:05:29.037855 IP localhost.domain > localhost.42538: 61240 Refused 0/0/0 (32)
03:05:29.037863 IP localhost.domain > localhost.42538: 21048 Refused 0/0/0 (32)
03:05:29.037941 IP localhost.59634 > localhost.domain: 36330+ A? ntp.ubuntu.com. (32)
03:05:29.037946 IP localhost.59634 > localhost.domain: 51179+ AAAA? ntp.ubuntu.com. (32)
03:05:29.037955 IP localhost.domain > localhost.59634: 36330 Refused 0/0/0 (32)
03:05:29.037963 IP localhost.domain > localhost.59634: 51179 Refused 0/0/0 (32)
03:05:29.037989 IP localhost.59634 > localhost.domain: 36330+ A? ntp.ubuntu.com. (32)
03:05:29.037993 IP localhost.59634 > localhost.domain: 51179+ AAAA? ntp.ubuntu.com. (32)
03:05:29.038000 IP localhost.domain > localhost.59634: 36330 Refused 0/0/0 (32)
03:05:29.038007 IP localhost.domain > localhost.59634: 51179 Refused 0/0/0 (32)
03:05:29.038147 IP localhost.55603 > localhost.domain: 41952+ A? ntp.ubuntu.com. (32)
03:05:29.038153 IP localhost.55603 > localhost.domain: 44775+ AAAA? ntp.ubuntu.com. (32)
03:05:29.038170 IP localhost.domain > localhost.55603: 41952 Refused 0/0/0 (32)
03:05:29.038179 IP localhost.domain > localhost.55603: 44775 Refused 0/0/0 (32)
03:05:29.038216 IP localhost.55603 > localhost.domain: 41952+ A? ntp.ubuntu.com. (32)
03:05:29.038220 IP localhost.55603 > localhost.domain: 44775+ AAAA? ntp.ubuntu.com. (32)
03:05:29.038226 IP localhost.domain > localhost.55603: 41952 Refused 0/0/0 (32)
03:05:29.038255 IP localhost.domain > localhost.55603: 44775 Refused 0/0/0 (32)
03:05:29.038375 IP localhost.59835 > localhost.domain: 13415+ A? ntp.ubuntu.com. (32)
03:05:29.038380 IP localhost.59835 > localhost.domain: 352+ AAAA? ntp.ubuntu.com. (32)
03:05:29.038385 IP localhost.domain > localhost.59835: 13415 Refused 0/0/0 (32)
03:05:29.038393 IP localhost.domain > localhost.59835: 352 Refused 0/0/0 (32)
03:05:29.038431 IP localhost.59835 > localhost.domain: 13415+ A? ntp.ubuntu.com. (32)
03:05:29.038436 IP localhost.59835 > localhost.domain: 352+ AAAA? ntp.ubuntu.com. (32)
03:05:29.038444 IP localhost.domain > localhost.59835: 13415 Refused 0/0/0 (32)
03:05:29.038452 IP localhost.domain > localhost.59835: 352 Refused 0/0/0 (32)
03:05:29.038536 IP localhost.58993 > localhost.domain: 1263+ A? ntp.ubuntu.com. (32)
03:05:29.038541 IP localhost.58993 > localhost.domain: 24046+ AAAA? ntp.ubuntu.com. (32)
03:05:29.038549 IP localhost.domain > localhost.58993: 1263 Refused 0/0/0 (32)
03:05:29.038558 IP localhost.domain > localhost.58993: 24046 Refused 0/0/0 (32)
03:05:29.038588 IP localhost.58993 > localhost.domain: 1263+ A? ntp.ubuntu.com. (32)
03:05:29.038595 IP localhost.58993 > localhost.domain: 24046+ AAAA? ntp.ubuntu.com. (32)
03:05:29.038601 IP localhost.domain > localhost.58993: 1263 Refused 0/0/0 (32)
03:05:29.038608 IP localhost.domain > localhost.58993: 24046 Refused 0/0/0 (32)
03:05:29.038698 IP localhost.60430 > localhost.domain: 61068+ A? ntp.ubuntu.com. (32)
03:05:29.038703 IP localhost.60430 > localhost.domain: 40323+ AAAA? ntp.ubuntu.com. (32)
03:05:29.038721 IP localhost.domain > localhost.60430: 61068 Refused 0/0/0 (32)
03:05:29.038733 IP localhost.domain > localhost.60430: 40323 Refused 0/0/0 (32)
03:05:29.038754 IP localhost.60430 > localhost.domain: 61068+ A? ntp.ubuntu.com. (32)
03:05:29.038759 IP localhost.60430 > localhost.domain: 40323+ AAAA? ntp.ubuntu.com. (32)
03:05:29.038775 IP localhost.domain > localhost.60430: 61068 Refused 0/0/0 (32)
03:05:29.038787 IP localhost.domain > localhost.60430: 40323 Refused 0/0/0 (32)
03:05:29.038883 IP localhost.58161 > localhost.domain: 59811+ A? ntp.ubuntu.com. (32)
03:05:29.038890 IP localhost.58161 > localhost.domain: 36764+ AAAA? ntp.ubuntu.com. (32)
03:05:29.038909 IP localhost.domain > localhost.58161: 59811 Refused 0/0/0 (32)
03:05:29.038922 IP localhost.domain > localhost.58161: 36764 Refused 0/0/0 (32)
03:05:29.038945 IP localhost.58161 > localhost.domain: 59811+ A? ntp.ubuntu.com. (32)
03:05:29.038950 IP localhost.58161 > localhost.domain: 36764+ AAAA? ntp.ubuntu.com. (32)
03:05:29.038970 IP localhost.domain > localhost.58161: 59811 Refused 0/0/0 (32)
03:05:29.038981 IP localhost.domain > localhost.58161: 36764 Refused 0/0/0 (32)
03:05:32.696802 IP localhost.64998 > localhost.domain: 19762+ A? ssl.gstatic.com. (33)
03:05:32.696855 IP localhost.domain > localhost.64998: 19762 Refused 0/0/0 (33)
03:05:32.697114 IP localhost.35478 > localhost.domain: 52301+ A? ssl.gstatic.com. (33)
03:05:32.697145 IP localhost.domain > localhost.35478: 52301 Refused 0/0/0 (33)
03:05:32.697184 IP localhost.47973 > localhost.domain: 47776+ HTTPS? ssl.gstatic.com. (33)
03:05:32.697195 IP localhost.domain > localhost.47973: 47776 Refused 0/0/0 (33)
03:05:32.697217 IP localhost.28076 > localhost.domain: 44624+ HTTPS? ssl.gstatic.com. (33)
03:05:32.697227 IP localhost.domain > localhost.28076: 44624 Refused 0/0/0 (33)
03:05:32.697550 IP localhost.41889 > localhost.domain: 3020+ A? ssl.gstatic.com. (33)
03:05:32.697604 IP localhost.domain > localhost.41889: 3020 Refused 0/0/0 (33)
03:05:32.697632 IP localhost.38684 > localhost.domain: 3020+ A? ssl.gstatic.com. (33)
03:05:32.697642 IP localhost.domain > localhost.38684: 3020 Refused 0/0/0 (33)
03:05:32.697868 IP localhost.59876 > localhost.domain: 21160+ A? ssl.gstatic.com. (33)
03:05:32.697889 IP localhost.domain > localhost.59876: 21160 Refused 0/0/0 (33)
03:05:32.697898 IP localhost.60421 > localhost.domain: 49073+ HTTPS? ssl.gstatic.com. (33)
03:05:32.697907 IP localhost.domain > localhost.60421: 49073 Refused 0/0/0 (33)
